{
  "routeId":"ACC-FI-MIGRATION-105","contentVersion":"1.0.0","line":"ACCOUNTING","title":"债券转托管与流通状态迁移","summary":"识别非交易状态迁移，连续结转数量、成本、估值增值和应计利息，并核对不确认普通买卖收益。","estimatedMinutes":45,
  "objectives":["区分转托管、流通迁移与普通买卖","连续迁移数量、成本、估值增值和应计利息","补全转入转出科目方向","把费用记录与余额迁移分开核对"],
  "steps":{"KNOWLEDGE_CARD":{"cards":[{"cardId":"FI-MG-KC-01","type":"CATEGORIES","title":"迁移不是买卖","conclusion":"转托管和未流通转流通是状态迁移，不产生普通买卖收益。","items":["转出和转入是同一持仓状态变化","不重新确认普通投资收益","数量、成本、估值增值和应计利息连续","费用另行读取批准资料"]},{"cardId":"FI-MG-KC-02","type":"FLOW","title":"四项余额必须成对迁移","conclusion":"转出科目与转入科目按同数量、同余额完成对应结转。","items":["转入成本=转出成本","转入估值增值=转出估值增值","转入应计利息=转出应计利息","转托管费用不混入余额迁移"]},{"cardId":"FI-MG-KC-03","type":"KEY_POINT","title":"流通迁移只改变科目状态","conclusion":"未流通转流通时，成本和估值增值转入流通科目，数量和余额总额保持连续。","items":["未流通成本转入流通成本","未流通估值增值转入流通估值增值","应计利息转入对应流通状态","不把科目迁移差额记为投资收益"]}]},"DEMONSTRATION":{"scenario":{"role":"产品甲的组合核算人员","product":"产品甲 / 债券甲","date":"2026-09-05","facts":["转托管资料确认同一证券从转出状态迁入目标托管状态，不是买卖。","转出数量 8,000 张，成本 780,000 元，估值增值 20,000 元，应计利息 4,000 元。","批准流通日将未流通科目迁入流通科目，数量不变。","转托管费用未提供现行费率快照，不计算费用，只核对它与余额迁移分开。"]},"steps":[{"order":1,"action":"读取业务类型，确认转托管或流通迁移不是普通买卖","reason":"业务类型决定是否产生买卖收益。"},{"order":2,"action":"读取转出数量、成本、估值增值和应计利息作为迁移前余额","reason":"四项余额分别从转出账簿带到转入科目，不能漏项。"},{"order":3,"action":"补全转入和转出科目，数量 8,000 张、成本 780,000 元、估值增值 20,000 元、应计利息 4,000 元逐项相等","reason":"每项转入金额都必须与转出金额对应。"},{"order":4,"action":"确认流通迁移只改变科目状态，不确认普通投资收益","reason":"非交易迁移不形成普通买卖收益。"},{"order":5,"action":"将未提供费率的转托管费用单独记为未计算事项，并核对费用与余额迁移分开","reason":"不能用历史费率补造费用金额。"}],"summary":"识别迁移→读取四项余额→补全转入转出→确认不计普通买卖收益→分开核对费用与余额"},"BASIC_PRACTICE":{"questions":[{"questionId":"ACC-FI-MIGRATION-Q-01","type":"FIELD_MAP","prompt":"识别非交易状态迁移。","fieldMappings":[{"fieldId":"business","label":"业务类型","source":"状态迁移资料","options":[{"optionId":"MIGRATION","text":"转托管/转流通，不是普通买卖"},{"optionId":"TRADE","text":"普通买卖"}]},{"fieldId":"income","label":"损益处理","source":"迁移凭证","options":[{"optionId":"NO_TRADE_INCOME","text":"不确认普通买卖收益"},{"optionId":"TRADE_INCOME","text":"确认普通投资收益"}]}],"answer":["MIGRATION","NO_TRADE_INCOME"],"explanation":"迁移只改变状态和科目位置。","hints":["先看业务类型，不看科目名称猜收益。"]},{"questionId":"ACC-FI-MIGRATION-Q-02","type":"CALCULATION","prompt":"核对迁移后的四项余额总额。","calculation":{"fields":[{"fieldId":"quantity","label":"数量","formula":"8,000","placeholder":"输入张数","unit":"张"},{"fieldId":"cost","label":"成本","formula":"780,000","placeholder":"输入金额","unit":"元"},{"fieldId":"valuation","label":"估值增值","formula":"20,000","placeholder":"输入金额","unit":"元"},{"fieldId":"interest","label":"应计利息","formula":"4,000","placeholder":"输入金额","unit":"元"}]},"answer":["8000","780000","20000","4000"],"explanation":"转入科目的数量、成本、估值增值和应计利息分别与转出账簿相等。","hints":["逐项比较转入与转出。"]},{"questionId":"ACC-FI-MIGRATION-Q-03","type":"LEDGER_ENTRY","prompt":"补全流通迁移的科目对象。","ledgerEntries":[{"entryId":"cost-debit","direction":"借","label":"流通成本","amount":"780,000.00 元","placeholder":"输入科目"},{"entryId":"cost-credit","direction":"贷","label":"未流通成本","amount":"780,000.00 元","placeholder":"输入科目"},{"entryId":"valuation-debit","direction":"借","label":"流通估值增值","amount":"20,000.00 元","placeholder":"输入科目"},{"entryId":"valuation-credit","direction":"贷","label":"未流通估值增值","amount":"20,000.00 元","placeholder":"输入科目"}],"answer":["债券投资-成本","债券投资-未流通成本","债券投资-估值增值","债券投资-未流通估值增值"],"explanation":"流通迁移逐项转入流通科目并结清未流通科目。","hints":["成本和估值增值分别配对。"]},{"questionId":"ACC-FI-MIGRATION-Q-04","type":"ORDERING","prompt":"按状态迁移资料排列正常处理顺序。","items":[{"itemId":"READ","text":"读取迁移资料和业务类型"},{"itemId":"BALANCE","text":"读取转出四项余额"},{"itemId":"POST","text":"补全转入转出凭证"},{"itemId":"CHECK","text":"勾稽数量和四项余额"}],"answer":["READ","BALANCE","POST","CHECK"],"explanation":"先从业务类型确认这是状态迁移，再读取余额和凭证方向。","hints":["不能先按普通卖出结转。"]},{"questionId":"ACC-FI-MIGRATION-Q-05","type":"RECONCILIATION","prompt":"把数量、四项余额和收益处理逐项对上。","reconciliation":{"fields":[{"fieldId":"quantity-check","label":"数量连续","kind":"NUMBER","formula":"8,000=8,000","placeholder":"输入张数"},{"fieldId":"balance-check","label":"余额连续","kind":"SELECT","formula":"成本、估值增值、应计利息均相等","placeholder":"选择结论","options":[{"optionId":"CONTINUOUS","text":"四项余额连续"},{"optionId":"BROKEN","text":"存在差异"}]},{"fieldId":"result","label":"迁移结论","kind":"SELECT","formula":"是否误确认买卖收益","placeholder":"选择结论","options":[{"optionId":"BALANCED","text":"迁移闭合且无普通买卖收益"},{"optionId":"BROKEN","text":"存在收益或余额错误"}]}]},"answer":["8000","CONTINUOUS","BALANCED"],"explanation":"数量、成本、估值增值和应计利息均连续，且未确认普通买卖收益。","hints":["余额连续和收益处理要同时检查。"]}]},"COMPREHENSIVE_PRACTICE":{"scenario":{"role":"产品乙的组合核算人员","product":"产品乙 / 债券乙","date":"2026-09-05","purpose":"根据正常状态迁移资料识别业务，读取四项余额，补全凭证方向，并逐项核对结果。"},"sourceMaterials":[{"materialId":"FI-MG-PARAM","title":"批准迁移参数","kind":"PARAMETER","description":"按资料给出的余额和精度处理；转托管费率未提供，因此不计算费用。","fields":[{"fieldId":"precision","label":"精度","value":"金额 2 位小数；数量 0 容差"},{"fieldId":"fee-scope","label":"费用范围","value":"不计算未提供费率的转托管费用"}]},{"materialId":"FI-MG-TRANSFER","title":"转托管业务记录","kind":"CONFIRMATION","description":"同一证券从转出状态进入目标托管状态的记录。","fields":[{"fieldId":"business","label":"业务类型","value":"债券转托管"},{"fieldId":"quantity","label":"数量","value":"8,000","unit":"张"},{"fieldId":"target","label":"目标状态","value":"目标托管状态"}]},{"materialId":"FI-MG-LEDGER","title":"转出余额台账","kind":"LEDGER","description":"迁移前的数量、成本、估值增值和应计利息余额。","fields":[{"fieldId":"cost","label":"成本","value":"780,000.00","unit":"元"},{"fieldId":"valuation","label":"估值增值","value":"20,000.00","unit":"元"},{"fieldId":"interest","label":"应计利息","value":"4,000.00","unit":"元"},{"fieldId":"quantity","label":"数量","value":"8,000","unit":"张"}]},{"materialId":"FI-MG-VOUCHER","title":"流通迁移凭证底稿","kind":"VOUCHER","description":"待补全流通与未流通成本、估值增值和应计利息科目。","fields":[{"fieldId":"cost","label":"成本","value":"780,000.00","unit":"元"},{"fieldId":"valuation","label":"估值增值","value":"20,000.00","unit":"元"},{"fieldId":"interest","label":"应计利息","value":"4,000.00","unit":"元"}]},{"materialId":"FI-MG-RESULT","title":"迁移后台账与费用边界","kind":"RECONCILIATION","description":"用于核对迁移后余额，以及未提供费率的费用边界。","fields":[{"fieldId":"quantity","label":"迁移后数量","value":"8,000","unit":"张"},{"fieldId":"income","label":"普通买卖收益","value":"0.00","unit":"元"},{"fieldId":"fee","label":"转托管费用","value":"未提供本案例费率，不计算"}]}],"workItems":[{"workItemId":"business","type":"FIELD_MAP","title":"识别迁移业务","instruction":"选择业务类型和收益处理。","response":{"kind":"SELECT","placeholder":"选择业务","options":[{"optionId":"MIGRATION","text":"非交易状态迁移"},{"optionId":"TRADE","text":"普通买卖"}]}},{"workItemId":"income","type":"FIELD_MAP","title":"收益处理","instruction":"确认是否产生普通买卖收益。","response":{"kind":"SELECT","placeholder":"选择结果","options":[{"optionId":"NO_TRADE_INCOME","text":"不确认普通买卖收益"},{"optionId":"TRADE_INCOME","text":"确认普通买卖收益"}]}},{"workItemId":"quantity","type":"CALCULATION","title":"迁移数量","instruction":"从转出台账读取数量。","response":{"kind":"NUMBER","placeholder":"输入张数","unit":"张","precision":0}},{"workItemId":"cost","type":"CALCULATION","title":"迁移成本","instruction":"读取转出成本并迁移同额。","response":{"kind":"NUMBER","placeholder":"输入金额","unit":"元","precision":2}},{"workItemId":"valuation","type":"CALCULATION","title":"迁移估值增值","instruction":"读取转出估值增值并迁移同额。","response":{"kind":"NUMBER","placeholder":"输入金额","unit":"元","precision":2}},{"workItemId":"interest","type":"CALCULATION","title":"迁移应计利息","instruction":"读取转出应计利息并迁移同额。","response":{"kind":"NUMBER","placeholder":"输入金额","unit":"元","precision":2}},{"workItemId":"cost-debit","type":"LEDGER_ENTRY","title":"转入成本科目","instruction":"填写借方转入成本科目。","response":{"kind":"TEXT","placeholder":"输入科目"}},{"workItemId":"cost-credit","type":"LEDGER_ENTRY","title":"转出成本科目","instruction":"填写贷方转出成本科目。","response":{"kind":"TEXT","placeholder":"输入科目"}},{"workItemId":"valuation-debit","type":"LEDGER_ENTRY","title":"转入估值科目","instruction":"填写借方转入估值科目。","response":{"kind":"TEXT","placeholder":"输入科目"}},{"workItemId":"valuation-credit","type":"LEDGER_ENTRY","title":"转出估值科目","instruction":"填写贷方转出估值科目。","response":{"kind":"TEXT","placeholder":"输入科目"}},{"workItemId":"interest-debit","type":"LEDGER_ENTRY","title":"转入利息科目","instruction":"填写借方转入应计利息科目。","response":{"kind":"TEXT","placeholder":"输入科目"}},{"workItemId":"interest-credit","type":"LEDGER_ENTRY","title":"转出利息科目","instruction":"填写贷方转出应计利息科目。","response":{"kind":"TEXT","placeholder":"输入科目"}},{"workItemId":"fee-boundary","type":"SHORT_TEXT","title":"费用边界","instruction":"说明资料未提供转托管费率时为什么不计算费用。","response":{"kind":"TEXT","placeholder":"输入边界说明"}},{"workItemId":"result","type":"RECONCILIATION","title":"迁移结果核对","instruction":"逐项核对数量、四项余额和收益处理。","response":{"kind":"SELECT","placeholder":"选择结论","options":[{"optionId":"BALANCED","text":"闭合"},{"optionId":"BROKEN","text":"不闭合"}]}},{"workItemId":"result-note","type":"SHORT_TEXT","title":"迁移结论","instruction":"写明迁移不产生普通买卖收益，以及四项余额如何连续。","response":{"kind":"TEXT","placeholder":"输入简短结论"}}],"submissionNote":"未提供转托管费率，因此不计算费用；提交前核对业务类型、四项余额、科目迁移和收益边界。"}},
  "references":[{"referenceId":"ACC-REF-FI-PPT-2025","title":"固定收益业务介绍（基础）","source":"固定收益培训 PPTX 第 25—27、35 页","usage":"转托管与流通的非交易迁移、四项余额连续和费用边界。"},{"referenceId":"ACC-REF-FI-CASE-PARAMETERS-202608","title":"本案例批准迁移参数","source":"ACC-FI-MIGRATION-105 综合实务资料包，2026.08 版本","usage":"仅约束本案例余额、状态和费用不计算边界。"}]
}
